{
  "id": "pmr",
  "contentVersion": 4,
  "title": "渐进式肌肉放松",
  "description": "先收紧再松开，用身体的对比感把一直绷着的地方卸下来。",
  "kind": "online",
  "level": "L1",
  "available": true,
  "form": "音频引导",
  "duration": "1 分 40 秒",
  "scoreLabel": "紧绷感",
  "suitedFor": "长期紧绷、放松不下来，或者晚上睡不着的时候",
  "coreMethod": "渐进式肌肉放松（PMR）",
  "tags": [
    "紧张",
    "疲惫"
  ],
  "scale": {
    "preLabel": "此刻身体的紧绷程度是多少？",
    "low": "很放松",
    "high": "非常紧绷",
    "direction": "down"
  },
  "stages": [
    {
      "type": "media",
      "presentation": "audio",
      "title": "跟着做一遍",
      "hint": "每个部位用力收紧几秒，再一下子完全松掉。要记住的是松开那一瞬间的感觉——那就是放松的样子。有伤或疼痛的部位跳过。 收紧的时候别憋气，正常呼吸。",
      "segments": [
        {
          "title": "双手",
          "hint": "握紧拳头，用力握住……然后突然全部松开，让手摊在腿上。",
          "seconds": 16
        },
        {
          "title": "手臂",
          "hint": "把手臂贴紧身体，绷紧上臂……松开，让手臂完全垂下来。",
          "seconds": 16
        },
        {
          "title": "面部",
          "hint": "皱起眉头、咬紧牙关、闭紧眼睛……全部松开，让脸垮下来。",
          "seconds": 16
        },
        {
          "title": "肩颈",
          "hint": "肩膀用力往耳朵方向耸起……松开，让它们直接掉下去。",
          "seconds": 16
        },
        {
          "title": "双腿",
          "hint": "绷紧大腿和小腿，脚趾往回勾……松开，把腿的重量交给椅子。",
          "seconds": 16
        },
        {
          "title": "全身",
          "hint": "现在什么都不做。感受收紧过和松开后的差别。",
          "seconds": 20
        }
      ]
    }
  ]
}
