{
  "id": "stretch-guide",
  "contentVersion": 4,
  "title": "工间舒展操",
  "description": "跟着计时做一遍肩颈和上肢的舒展，让伏案一上午的身体动起来。全程坐着就能完成。",
  "kind": "online",
  "level": "L1",
  "available": true,
  "form": "视频跟练",
  "duration": "2 分 35 秒",
  "scoreLabel": "疲惫感",
  "suitedFor": "久坐之后肩颈发僵、想活动一下又不想离开工位",
  "coreMethod": "分段计时的坐姿舒展",
  "tags": [
    "疲惫"
  ],
  "scale": {
    "preLabel": "此刻的身体疲惫程度是多少？",
    "low": "轻松",
    "high": "非常疲惫",
    "direction": "down"
  },
  "stages": [
    {
      "type": "media",
      "presentation": "video",
      "title": "跟着做完这一轮",
      "hint": "把椅子往后推一点，确认抬手不会碰到东西。全程坐着做，动作幅度以不痛为准——酸胀是对的，疼就停。 每一段结束会自动切到下一段，不用管时间。",
      "segments": [
        {
          "title": "耸肩放下",
          "hint": "肩膀用力往上耸到最高，停两秒，然后一下子放下来。重复到这段结束。",
          "seconds": 25
        },
        {
          "title": "颈部左右侧倾",
          "hint": "头缓慢倒向左肩，感到侧颈拉住就停住，别用手压。左右交替。",
          "seconds": 30
        },
        {
          "title": "扩胸后展",
          "hint": "双手在身后交握，胸口向前打开，肩胛骨往中间靠拢。",
          "seconds": 25
        },
        {
          "title": "手臂上举拉伸",
          "hint": "两手交叉向上推，掌心朝天，感受侧腰和肩膀被拉开。",
          "seconds": 25
        },
        {
          "title": "转腰",
          "hint": "手扶椅背，上身缓慢转向一侧，停住，再换另一侧。",
          "seconds": 30
        },
        {
          "title": "收束呼吸",
          "hint": "手放回腿上，什么都不做，慢慢呼吸几次。",
          "seconds": 20
        }
      ]
    }
  ]
}
