{
  "id": "writing-practice",
  "contentVersion": 6,
  "title": "情绪书写练习",
  "description": "用分步书写把发生的事、当时的感受和脑中的想法分开，看看哪部分最让你难受。所写内容只留在当前页面，不上传、不保存；可以跳过不想写的部分。",
  "kind": "online",
  "level": "L1",
  "available": true,
  "form": "分步书写",
  "duration": "5 分钟",
  "scoreLabel": "委屈感",
  "suitedFor": "被误解、憋着一股说不出的委屈，或者脑子里一句话反复转的时候",
  "coreMethod": "情绪与想法记录（七步）",
  "tags": [
    "委屈"
  ],
  "scale": {
    "preLabel": "此刻的委屈感是多少？",
    "low": "已经好些",
    "high": "非常委屈",
    "direction": "down"
  },
  "stages": [
    {
      "type": "component",
      "component": "writing-practice",
      "title": "情绪与想法记录",
      "hint": "七步，一页一题：事实 → 情绪 → 第一想法 → 支持 → 不支持 → 更完整的看法 → 再评情绪。可以回上一步，写的内容不出这页。",
      "fallbackHint": "情绪书写七步（纸笔也可做）：1）只写事实，不写评价。2）写下情绪并打分0–100。3）写下第一时间冒出的想法，并给相信程度打分。4）列出支持这个想法的事实。5）列出不太支持它的事实。6）写一个把两边都装进来的、更完整的看法——不是强行乐观。7）重新给情绪打分，看看变化。"
    }
  ]
}
