{
  "id": "value-anchor",
  "contentVersion": 6,
  "title": "职业价值锚点练习",
  "description": "借鉴 ACT 的价值澄清方法，从你重视的生活领域出发，找到想体现的品质，再为接下来的 24 小时选一个做得到的小行动。没有标准答案，也不用当场想清职业方向。",
  "kind": "online",
  "level": "L1",
  "available": true,
  "form": "四步文字互动",
  "duration": "约 5–8 分钟",
  "scoreLabel": "可控感",
  "suitedFor": "工作方向变化、压力增大，或想重新看清自己重视什么的时候",
  "coreMethod": "ACT 价值澄清 + 微小承诺行动",
  "tags": ["可控感"],
  "scale": {
    "preLabel": "此刻你对自己想走的方向有多少把握？",
    "low": "完全没有头绪",
    "high": "方向比较清楚",
    "direction": "up"
  },
  "stages": [{
    "type": "component",
    "component": "value-anchor",
    "title": "找到自己的价值方向",
    "hint": "从工作、家庭、朋友、学习、健康、社区或自己等领域选一个，想想希望如何行动与待人，再写下未来 24 小时能做的一件小事。价值是方向，不等于职位或结果。文字只在本页显示，不会上传。",
    "fallbackHint": "先选一个此刻重要的生活领域：工作、家庭、朋友、学习与成长、健康、社区或自己。想想在这个领域里，希望自己是一个怎样的人，例如可靠、有耐心、诚实、关心别人或保持好奇；也可以用自己的词。把它写成一句关于行动方向的话，而非“我要升职”这样的结果目标。最后写下一件未来 24 小时可以开始的小行动，例如花 15 分钟弄清一个问题。今天朝自己重视的方向走一步。"
  }]
}
