{
  "id": "return-rhythm",
  "contentVersion": 5,
  "title": "返岗节奏重建练习",
  "description": "准备返岗或刚回到岗位时，用几个问题梳理眼下能承受的工作量、可能需要的调整和两周内的安排，形成一份供自己参考的草案。计划不是承诺，可按实际情况修改。",
  "kind": "online",
  "level": "L1",
  "available": true,
  "form": "私人计划填写",
  "duration": "约 8 分钟",
  "scoreLabel": "可控感",
  "suitedFor": "休假或离岗后准备返岗，或返岗初期需要与相关人员商议工作节奏时",
  "coreMethod": "个别化工作调整 + 分阶段返岗 + 定期复盘",
  "tags": ["可控感"],
  "scale": {
    "preLabel": "此刻你对返岗节奏的可控感是多少？",
    "low": "完全失控",
    "high": "比较从容",
    "direction": "up"
  },
  "stages": [{
    "type": "component",
    "component": "return-rhythm",
    "title": "写下我的返岗节奏草案",
    "hint": "先梳理当前工作承受范围，再选择可能有帮助的调整、填写两周安排与复盘日期。预警信号仅在私人版本显示；可分享版本由你自行检查与复制，不会自动发送。",
    "fallbackHint": "返岗节奏草案可以包含：目前可承受的工作量与较困难的工作环节；希望商议的时间、地点、任务和支持调整；第 1 周与第 2 周各自的工作日、时段、优先任务和暂缓任务；节奏过快时的预警信号及应对；以及双方商定的复盘时间。工作安排应结合本人需求和岗位实际协商，不必套用统一的工作比例。个人预警信号不要默认分享给主管或 HR。"
  }]
}
