{
  "id": "pause-card",
  "contentVersion": 5,
  "title": "情绪暂停提醒卡片",
  "description": "情绪突然上来时，跟着卡片停一分钟：给此刻的感受起个名字，留意脚下和周围，把注意带回眼前。想停就停，不必把情绪马上变好。",
  "kind": "online",
  "level": "L1",
  "available": true,
  "form": "互动卡片",
  "duration": "约 1 分钟",
  "scoreLabel": "烦躁感",
  "suitedFor": "情绪一下子上来、脑子有点乱、想先停一下的时候",
  "coreMethod": "WHO 注意并命名 + 着陆（Notice and Name + Grounding）",
  "tags": [
    "烦躁"
  ],
  "scale": {
    "preLabel": "此刻的烦躁程度是多少？",
    "low": "很平静",
    "high": "非常烦躁",
    "direction": "down"
  },
  "stages": [
    {
      "type": "component",
      "component": "pause-card",
      "title": "一分钟情绪暂停",
      "hint": "给此刻的感受一个名字；在心里说「我注意到……」；感受脚下的支撑，再留意眼前、耳边或身体接触到的事物。无需等情绪消失。",
      "fallbackHint": "情绪暂停卡：先为当下的感受找一个接近的词，在心里说「我注意到，现在有一些……」。如果脑中有反复出现的想法，也可以说「我注意到，脑中出现了……这个想法」。然后感受双脚和椅子或地面对身体的支撑，让呼吸自然来去，不必刻意深呼吸。看看周围、听听周围、感觉身体正碰到什么。最后问自己：接下来，愿意先做哪一件小事？情绪可以还在。"
    }
  ]
}
