{
  "id": "bodyscan-text",
  "contentVersion": 3,
  "title": "工间身体扫描",
  "description": "从头到脚逐个部位停留一会儿，把「说不清哪里累」变成具体的位置。",
  "kind": "online",
  "level": "L1",
  "available": true,
  "form": "线上跟练",
  "duration": "4 分钟",
  "scoreLabel": "疲惫感",
  "suitedFor": "久坐伏案之后，身体钝钝地累但说不清哪里累",
  "coreMethod": "分部位的身体觉察",
  "tags": ["疲惫"],
  "scale": {
    "preLabel": "此刻的身体疲惫程度是多少？",
    "low": "轻松",
    "high": "非常疲惫",
    "direction": "down"
  },
  "stages": [
    {
      "type": "prompt",
      "title": "不用换地方",
      "hint": "就坐在工位上做。可以闭眼，也可以看着屏幕，两种都行。"
    },
    {
      "type": "scan",
      "title": "从头往下走一遍",
      "hint": "每个部位停留一会儿，只是去感觉，不需要改变什么。",
      "parts": [
        { "icon": "🧠", "name": "头顶与额头", "hint": "感受头皮的重量，让眉心之间松开。", "seconds": 14 },
        { "icon": "👁️", "name": "眼睛与下颌", "hint": "盯了几小时屏幕的眼睛，还有可能一直咬着的后槽牙。", "seconds": 14 },
        { "icon": "🫀", "name": "肩颈与胸口", "hint": "留意肩膀是不是不自觉地耸着，随着呼气让它落下来。", "seconds": 16 },
        { "icon": "🤲", "name": "手臂与双手", "hint": "感受手指的温度。握了一天鼠标的手，现在可以完全摊开。", "seconds": 14 },
        { "icon": "🪑", "name": "腰背", "hint": "觉察椅背和坐垫托住你的地方，把重量交给它们。", "seconds": 14 },
        { "icon": "🦶", "name": "双腿与双脚", "hint": "感受双脚踩在地面上的支撑感，这是身体和地面唯一的接触。", "seconds": 14 }
      ]
    },
    {
      "type": "choice",
      "title": "哪里最紧？",
      "hint": "记住这个位置。它通常就是你身体最先替你扛压力的地方。",
      "options": [
        { "icon": "🫀", "label": "肩颈", "desc": "最常见的伏案紧张点", "reflection": "肩颈的紧绷往往和「一直端着」有关。下次注意到它耸起来时，就是提醒自己该起身的信号。" },
        { "icon": "👁️", "label": "眼睛与下颌", "desc": "长时间专注留下的痕迹", "reflection": "咬紧牙关和盯屏幕通常一起出现。每隔一段时间看看远处，比揉眼睛管用。" },
        { "icon": "🪑", "label": "腰背", "desc": "久坐的直接后果", "reflection": "腰背的酸是坐姿累积出来的，靠放松很难完全解决——它更需要的是站起来走动。" },
        { "icon": "🌫️", "label": "说不太清", "desc": "整体都有点沉", "reflection": "分不清具体位置，常常说明累的是精神而不只是身体。这种时候休息比拉伸更有用。" }
      ]
    }
  ]
}
